Title,PublishedAt,ViewCount,LikeCount,DislikeCount,CommentCount,Duration,URL
I CREATE FRAUD DETECTION MACHINE LEARNING MODEL USING PYTHON | | Machine learning projects,2023-10-02T16:00:07Z,111,1,0,0,3.77,https://www.youtube.com/watch?v=43ECUkOOmG0
I import Excel file with pandas and display it to Console in 4sec using Python | #python #code #fyp,2023-05-04T14:11:27Z,17012,349,0,2,0.15,https://www.youtube.com/watch?v=eesyMsoWsE4
f-string in python | python for beginners,2023-10-29T16:00:34Z,70,3,0,2,2.65,https://www.youtube.com/watch?v=hC0V1YHraWY
Adding data to excel file using Python | python excel | python in excel | python and excel,2023-11-10T13:00:16Z,105,3,0,0,2.62,https://www.youtube.com/watch?v=JEBS94yFIwE
I Create Text to Speech Convertor in One Minute using Python,2023-05-29T17:10:41Z,66,2,0,0,1.03,https://www.youtube.com/watch?v=uxPDGjJxOQY
I CREATE AI BASED DEFENSE SYSTEM USING PYTHON,2023-10-20T15:00:18Z,117,4,0,0,2.62,https://www.youtube.com/watch?v=M20AwCBmwq0
Tickle your funny bone | Watch how Python Generates Jokes | #python #coding #funny #code,2023-06-04T15:43:56Z,61,3,0,0,1.52,https://www.youtube.com/watch?v=vdqSCeIjmKo
PYTHON FULL COURSE | PYTHON FOR BEGINNERS | PYTHON INSTALLATION AND SETUP,2023-09-21T14:00:27Z,214,3,0,1,3.0,https://www.youtube.com/watch?v=TyKWRa8YqZU
PYTHON FULL COURSE | PYTHON FOR BEGINNERS | PYTHON Functions,2023-09-29T13:00:02Z,64,4,0,0,3.13,https://www.youtube.com/watch?v=2QxNDBURNbI
I Create Spam Detection Machine Learning Model Using Python & python projects & python for beginner,2023-12-11T16:00:20Z,94,2,0,0,5.0,https://www.youtube.com/watch?v=NEvG6S6QjN8
PYTHON FULL COURSE | PYTHON FOR BEGINNERS | PYTHON Course Conclusion,2023-09-29T13:00:46Z,68,4,0,2,1.17,https://www.youtube.com/watch?v=mohsF1GrA-M
PYTHON FULL COURSE | PYTHON FOR BEGINNERS | YOUR FIRST PYTHON PROGRAM,2023-09-21T14:00:23Z,90,2,0,0,2.8,https://www.youtube.com/watch?v=cFNBMhbTwnw
I CREATE ANIMATION APP IN ONE MINUTE USING PYTHON,2023-07-15T16:15:02Z,157,6,0,0,1.13,https://www.youtube.com/watch?v=YhNb4sG7Pb4
Python pandas tutorial | python pandas | python with pandas | #python #pythonpandas,2023-09-19T14:00:37Z,110,3,0,0,5.97,https://www.youtube.com/watch?v=mSJeDc1mjro
I create web traffic predictor machine learning model using Python,2023-10-25T16:00:44Z,232,6,0,2,4.3,https://www.youtube.com/watch?v=qeu6oS_QWmc
Pandas Dataframe with CSV file in 5 sec | python pandas | python excel | python in excel,2024-03-24T16:00:04Z,157,6,0,0,0.3,https://www.youtube.com/watch?v=7OwcV0QD05c
PYTHON FULL COURSE | PYTHON FOR BEGINNERS | PYTHON For Loop,2023-09-26T13:00:29Z,65,0,0,0,2.82,https://www.youtube.com/watch?v=c1zOotWGxbA
I CREATE CONTENT IDEAS GENERATOR USING PYTHON,2023-10-23T16:00:23Z,58,3,0,0,3.77,https://www.youtube.com/watch?v=XIjcOg5qgus
PYTHON FULL COURSE | PYTHON FOR BEGINNERS | Python If statement,2023-09-22T14:00:02Z,73,0,0,0,3.2,https://www.youtube.com/watch?v=2yyultOvfmc
I Create Machine learning model that recognize human's activity with Python & python projects,2023-12-02T16:00:17Z,1254,34,0,0,4.2,https://www.youtube.com/watch?v=_3HkF2K_1h4
PYTHON FULL COURSE | PYTHON FOR BEGINNERS | PYTHON Elif statement,2023-09-24T07:00:06Z,58,0,0,0,2.6,https://www.youtube.com/watch?v=8yocy07k7iA
PYTHON FULL COURSE | PYTHON FOR BEGINNERS | Python Variables and Datatypes,2023-09-21T14:00:38Z,73,2,0,0,4.35,https://www.youtube.com/watch?v=ku4hydiE78s
I Create Art Version of image in one minute using Python | #python #coding #programming #code,2023-05-30T16:56:56Z,53,2,0,0,1.02,https://www.youtube.com/watch?v=3hEoMxtIp2k
PYTHON FULL COURSE | PYTHON FOR BEGINNERS | PYTHON While Loop,2023-09-25T13:00:19Z,61,0,0,0,3.08,https://www.youtube.com/watch?v=UFqg0C-NTMM
I Create Excel file in 5sec using Python || python excel || python pandas || python to excel #python,2024-03-26T16:00:35Z,279,13,0,0,0.17,https://www.youtube.com/watch?v=iju6xKZacGQ
PYTHON EXCEL || PYTHON IN EXCEL || PYTHON PANDAS,2023-09-12T14:00:25Z,198,1,0,0,3.7,https://www.youtube.com/watch?v=KwprJxm2674
Ternary operator in python | python for beginners,2023-11-03T16:00:01Z,136,5,0,0,2.48,https://www.youtube.com/watch?v=2d6XfN4LxfY
PYTHON EXCEL TUTORIAL || PYTHON IN EXCEL,2023-09-05T15:00:37Z,269,8,0,0,3.12,https://www.youtube.com/watch?v=nCI1LVT_7Fs
PYTHON FULL COURSE | PYTHON FOR BEGINNERS | PYTHON File Operations,2023-09-29T13:00:44Z,56,0,0,0,3.02,https://www.youtube.com/watch?v=rzNle_u6h3c
Enumerate function in python | python for beginners | #python,2023-11-04T16:00:31Z,34,2,0,0,2.08,https://www.youtube.com/watch?v=ZyYz1V6L3EQ
I CREATE COUNTRIES ECONOMIES PREDICTION MACHINE LEARNING MODEL USING PYTHON,2023-10-09T16:00:34Z,363,12,0,1,5.52,https://www.youtube.com/watch?v=fCVGF8a1vOA
Introduction to Python 2023 | Python for beginners,2023-04-03T09:25:16Z,89,3,0,0,4.8,https://www.youtube.com/watch?v=x5Xq1laR9Q0
I CREATE FASHION DESIGNER AI USING PYTHON,2023-09-23T13:00:19Z,389,5,0,0,3.2,https://www.youtube.com/watch?v=TKlbyddy1Gw
I Create Excel File using Python | python in excel | openpyxl | python to excel python excel,2023-11-30T09:15:23Z,122,7,0,0,1.62,https://www.youtube.com/watch?v=sOVp8Jmqnr8
if-else statement in Python | python for beginners | python,2023-11-05T16:00:01Z,27,1,0,1,2.3,https://www.youtube.com/watch?v=1F-_JWJYylE
unpacking elements in python | python for beginners | python beginners | python,2023-11-09T13:00:58Z,25,1,0,0,1.72,https://www.youtube.com/watch?v=zS2CJVWzNNM
I Create ATM App Using Python && Learn Python By Building Simple Projects,2024-03-25T16:00:21Z,93,9,0,0,4.28,https://www.youtube.com/watch?v=R-a3o_8zv4U
Filter CSV file in 5sec using pandas Python | python excel | python to excel | python pandas,2024-03-23T16:00:41Z,62,3,0,0,0.23,https://www.youtube.com/watch?v=uEO6Cq4THos
I CREATE MACHINE LEARNING MODEL USING PYTHON | #python,2023-10-01T16:00:14Z,364,10,0,1,2.22,https://www.youtube.com/watch?v=PMQOkzsZ1Dw
I CREATE DASHBOARD USING PYTHON & PYTHON DASHBOARD,2023-09-16T14:00:21Z,2599,52,0,0,2.2,https://www.youtube.com/watch?v=cZ229GTnWkY
for loop in python | python for beginners,2023-11-07T16:00:18Z,82,0,0,0,1.87,https://www.youtube.com/watch?v=JYDz4T62RyA
lambda function in python #python python for beginners,2023-11-02T16:00:26Z,33,2,0,0,2.58,https://www.youtube.com/watch?v=MhNn7iuJ6M0
I Create Dashboard in One Minute using Python | Python for beginners | #python #coding #programming,2023-05-28T16:29:14Z,117553,1216,0,18,1.07,https://www.youtube.com/watch?v=zvDvixsjOS8
List Comprehensions in Python #python python for beginners,2023-10-28T13:00:04Z,22,0,0,2,2.62,https://www.youtube.com/watch?v=6Lq4KvtKR4o
I CREATE SENTIMENTS ANALYSIS MACHINE LEARNING MODEL USING PYTHON | Machine learning projects,2023-10-03T13:00:37Z,90,3,0,2,3.28,https://www.youtube.com/watch?v=f0VDlRFHFcE
How to declare functions in python #python python for beginners,2023-10-31T16:00:25Z,53,2,0,1,3.52,https://www.youtube.com/watch?v=PX2AAogWO2w
I Read CSV file with pandas in 5sec using Python | python to excel | python in excel | pandas excel,2024-03-22T17:00:25Z,43,1,0,0,0.25,https://www.youtube.com/watch?v=_Z5eIMZ_Gro
PYTHON FULL COURSE | PYTHON FOR BEGINNERS | PYTHON Break and Continue Statement,2023-09-27T13:00:03Z,46,0,0,0,4.7,https://www.youtube.com/watch?v=55vI__U7YxQ
3 PYTHON PANDAS TRICKS THAT SAVE YOUR TIME,2023-09-20T12:13:45Z,80,0,0,0,2.7,https://www.youtube.com/watch?v=mhym-R-mmzE
I CREATE TODO LIST APP IN ONE MIN,2023-07-12T15:22:51Z,173,4,0,1,2.8,https://www.youtube.com/watch?v=xgkEm3xIbN8
I CREATE DRAWING APPLICATION USING PYTHON,2023-09-17T13:00:28Z,472,9,0,0,4.37,https://www.youtube.com/watch?v=ec5LooEwshs
Instagram bot in 5sec using Python,2024-03-27T12:12:41Z,275,17,0,0,0.17,https://www.youtube.com/watch?v=rJjuC9fqG28
I CREATE STOCK PRICE PREDICTION MACHINE LEARNING MODEL USING PYTHON | Machine learning projects,2023-10-11T16:00:34Z,195,4,0,0,3.9,https://www.youtube.com/watch?v=XdxyQn_Kyss
I Create Trading Bot using Python | Python trading bot | python projects | python for beginners,2023-09-26T13:00:27Z,212,5,0,0,4.55,https://www.youtube.com/watch?v=cKoesTP7pSs
input function in python | python for beginners | python,2023-11-06T16:00:24Z,32,0,0,0,2.12,https://www.youtube.com/watch?v=d4m4dP2yM-8
I Create Face recognition in One Minute Using Python | #python #code,2023-04-07T14:07:39Z,607,11,0,2,1.07,https://www.youtube.com/watch?v=mDKRsaCr0sY
I create web crawler using python,2023-11-25T16:00:05Z,104,4,0,0,3.27,https://www.youtube.com/watch?v=BAubvTu80Y4
I Create mobile price predictor machine learning model using Python,2023-10-26T16:00:46Z,85,3,0,2,4.03,https://www.youtube.com/watch?v=pQijM3aGCd0
Sentiment Analysis AI in 4sec Using Python || python programming #python,2024-03-25T17:00:07Z,101,7,0,0,0.17,https://www.youtube.com/watch?v=FDyZ3TJKW-Y
PYTHON EXCEL TUTORIAL  | PYTHON EXCEL | PYTHON PANDAS | PYTHON IN EXCEL,2023-09-09T15:00:24Z,374,7,0,2,3.53,https://www.youtube.com/watch?v=dBpPMGuyOP0
Todo list app in 15sec using Python | python projects for beginners | #python #programming #coding,2024-03-05T04:45:17Z,130,10,0,0,0.42,https://www.youtube.com/watch?v=YgJoiA2D4Jo
Digital Clock app in 10sec using Python && python for beginners #python,2024-03-14T15:00:00Z,46,5,0,0,0.43,https://www.youtube.com/watch?v=-gd26kn_B4I
I CREATE FUTURE PREDICTOR AI USING PYTHON || #python,2023-10-01T13:00:21Z,60,4,0,0,3.22,https://www.youtube.com/watch?v=DCbXXWvbP6Y
Crypto price tracker app in 15sec using Python || python || #python #programming,2024-03-21T14:30:12Z,46,3,0,0,0.58,https://www.youtube.com/watch?v=fmdmwB39stE
I Create Online Store Sales Predictor Machine Learning Model Using Python,2023-10-27T16:00:52Z,53,3,0,0,3.7,https://www.youtube.com/watch?v=tUCtZhGiEsk
StopWatch in 15sec using Python | python projects for beginners | #python #programming #coding,2024-03-05T16:54:00Z,64,4,0,0,0.45,https://www.youtube.com/watch?v=QXSHSIo1BM8
Unit Convertor app in 30sec using Python | python for beginners | #python #programming #coding,2024-03-16T13:00:33Z,38,4,0,0,0.8,https://www.youtube.com/watch?v=TL8tG-dQvZo
Currency Convertor app in 50 sec using Python | python for beginners | #python #programming,2024-03-15T13:00:15Z,38,5,0,1,1.02,https://www.youtube.com/watch?v=GXx-n8y1ldg
Turtle design in 10sec using Python | python programming | #python #graphicsdesign,2024-03-19T15:00:27Z,32,1,0,0,0.43,https://www.youtube.com/watch?v=Whmi_buxILY
I CREATE GALAXY ATTACKER SHOOTER GAME USING PYTHON,2023-08-28T16:00:16Z,311,7,0,0,4.52,https://www.youtube.com/watch?v=RVd2d09aQO4
Chatbot AI in 30 sec using Python #python #programming,2024-03-18T13:00:37Z,55,2,0,0,0.68,https://www.youtube.com/watch?v=ZjHuGAgGlYo
Sentence Capitalizer app in 10 sec using Python | python projects for beginners | #python #coding,2024-03-13T12:49:46Z,26,1,0,0,0.42,https://www.youtube.com/watch?v=pJB-g26jhiY
I CREATE PRODUCT INVENTORY APP USING PYTHON,2024-03-12T16:00:08Z,121,10,0,0,5.6,https://www.youtube.com/watch?v=AWMztQTUSUI
I CREATE GOOGLE USING PYTHON,2024-01-31T16:00:27Z,840,18,0,0,6.12,https://www.youtube.com/watch?v=RolzxUC2NI4
I CREATE SALES PREDICTOR MACHINE LEARNING MODEL USING PYTHON | Machine learning projects,2023-10-15T16:00:22Z,165,3,0,0,5.17,https://www.youtube.com/watch?v=WDlKOoGMaPw
PYTHON FULL COURSE | PYTHON FOR BEGINNERS | PYTHON Exception Handling,2023-09-29T13:00:43Z,44,0,0,0,3.42,https://www.youtube.com/watch?v=oevdsnPjP3A
I CREATE FLYING ROLLING COASTER GAME USING PYTHON | PYGAME PYTHON,2023-10-02T13:00:00Z,195,9,0,4,4.77,https://www.youtube.com/watch?v=-4M5yjaOS6g
I CREATE VPN APP IN 1 MINUTE USING PYTHON & VPN UI USING TKINTER,2023-07-19T16:10:00Z,24635,426,0,21,1.28,https://www.youtube.com/watch?v=iyDUyRCNoEc
I CREATE TEXT EDITOR APP IN ONE MINUTE USING PYTHON,2023-07-17T16:50:00Z,7781,125,0,5,1.53,https://www.youtube.com/watch?v=1EShyL0MwVI
I Create Web Scraper using Python | python for beginners | python projects,2023-11-12T16:00:20Z,699,28,0,3,2.38,https://www.youtube.com/watch?v=Z1_qiCyE9mI
I Create Math teacher AI using Python | Learn Math with Python,2023-09-28T13:00:42Z,156,4,0,0,4.3,https://www.youtube.com/watch?v=pQbGfQFbZy8
Zip function in python #python python for beginners,2023-11-01T16:00:47Z,33,3,0,0,2.6,https://www.youtube.com/watch?v=uqr2E1IvXlI
Expense tracker app in 30sec using Python | python projects for beginners | #python #programming,2024-03-17T13:00:43Z,172,10,0,1,0.78,https://www.youtube.com/watch?v=iEnkclrexIA
I Create Vpn Using Python | python projects | python vpn | vpn python | python for beginners,2023-11-22T16:00:26Z,3845,81,0,6,3.92,https://www.youtube.com/watch?v=eVnPWme_f-U
Introduction to excel in Python  | python excel | python in excel | python to excel,2023-11-28T16:00:13Z,108,3,0,0,2.75,https://www.youtube.com/watch?v=L7oA-XFuFPs
I Create Exam Score Predictor Machine Learning Model Using Python,2023-10-24T16:00:03Z,123,2,0,3,3.33,https://www.youtube.com/watch?v=39TcGRO_r84
I Create Stock Price Prediction Machine Learning Model with Python & python projects,2023-12-07T16:00:37Z,196,14,0,0,7.4,https://www.youtube.com/watch?v=uQRmbHtSKas
I CREATE DRAWING APP IN ONE MINUTE USING PYTHON,2023-07-14T15:32:05Z,837,24,0,3,1.17,https://www.youtube.com/watch?v=b0vwWFb620o
I Create HealthCare Machine Learning Model Using Python | Machine learning projects,2023-10-10T16:00:17Z,468,7,0,0,3.33,https://www.youtube.com/watch?v=KwahxwV--zo
I CREATE PHOTO EDITOR IN 1 MINUTE USING PYTHON,2023-07-23T16:00:01Z,3497,65,0,9,1.6,https://www.youtube.com/watch?v=1N6y4GH7MJw
Reversed function in python #python python for beginners,2023-10-30T16:00:10Z,382,9,0,0,2.27,https://www.youtube.com/watch?v=GUjMHpZ15Yg
I Convert PDF to Word file in just few lines of code | using Python | #python #code #programming,2023-04-08T14:16:30Z,409,10,0,0,1.08,https://www.youtube.com/watch?v=-Sm6vAR4Y5c
I CREATE INSTAGRAM APP USING PYTHON && PYTHON PROJECTS FOR BEGINNERS && PYTHON PROGRAMMING,2024-03-16T16:00:09Z,110,6,0,0,5.75,https://www.youtube.com/watch?v=CVHxHRo9Cy4
I CREATE ONLINE BANKING APP USING PYTHON && PYTHON PROGRAMMING & PROJECTS FOR BEGINNERS,2024-02-07T16:00:30Z,2947,90,0,10,7.12,https://www.youtube.com/watch?v=V2yRu-WV5nY
I Create Crypto Currency Prices Tracker Using Python | python projects | python for beginners,2023-11-19T16:01:00Z,264,8,0,0,2.63,https://www.youtube.com/watch?v=i0Szw1HbVCU
I CREATE UBER APP USING PYTHON && PYTHON PROJECTS FOR BEGINNERS,2024-01-02T16:00:16Z,1271,14,0,7,8.23,https://www.youtube.com/watch?v=X922A6M2efY
I Create product recommendation Machine learning model using Python | Machine learning projects,2023-10-17T16:00:21Z,323,6,0,0,3.7,https://www.youtube.com/watch?v=Vi1GModl6cM
I CREATE DELIVERY ROBOT SIMULATOR USING PYTHON && PYTHON PROJECTS && PYTHON IN ROBOTICS,2024-02-27T16:00:02Z,122,8,0,1,6.67,https://www.youtube.com/watch?v=aZxaJ-czV_w
I Create Machine Learning Model that predict Flight Delay with Python & python projects,2023-12-15T16:00:13Z,306,13,0,2,4.85,https://www.youtube.com/watch?v=N2Jj8JTvt3U
I CREATE PUZZLE BUBBLE GAME IN ONE MINUTE USING PYTHON,2023-08-13T16:00:42Z,1960,46,0,2,1.97,https://www.youtube.com/watch?v=xxlnj0_dKm4
I CREATE FRUIT CATCHER GAME USING PYTHON || PYTHON PYGAME || PYTHON PROGRAMMING,2024-03-19T16:00:42Z,313,13,0,1,4.97,https://www.youtube.com/watch?v=qVVIFy_36S8
I CREATE CANDY CRUSH GAME USING PYTHON,2023-08-21T17:27:24Z,3233,48,0,3,3.43,https://www.youtube.com/watch?v=01SLsXA77-o
I CREATE HOUSE PRICE PREDICTION MACHINE LEARNING MODEL USING PYTHON | Machine learning projects,2023-10-05T16:00:05Z,695,23,0,1,3.73,https://www.youtube.com/watch?v=99_PsMtNysY
I CREATE DATA CLEANING AI USING PYTHON || PYTHON MACHINE LEARNING PROJECTS,2024-03-29T09:01:07Z,124,10,0,0,3.12,https://www.youtube.com/watch?v=YlBYKM00tPg
I CREATE FITNESS TRACKER APP USING PYTHON || PYTHON PROJECTS FOR BEGINNERS || PYTHON PROGRAMMING,2024-03-21T16:00:00Z,819,14,0,6,5.12,https://www.youtube.com/watch?v=0-LDsQpKYFU
I CREATE VIRTUAL ENVIRONMENT IN 1 MINUTE USING PYTHON,2023-08-04T15:00:26Z,827,0,0,6,1.38,https://www.youtube.com/watch?v=ICD-9I_psAE
I CREATE ENDLESS OBSTACLES GAME USING PYTHON & PYTHON PYGAME,2023-12-21T16:00:20Z,488,13,0,5,8.25,https://www.youtube.com/watch?v=ef1eos10C6c
I CREATE LUDO GAME USING PYTHON,2023-08-17T16:00:11Z,5002,91,0,4,3.2,https://www.youtube.com/watch?v=GzuD70-WGAg
I Create Lie Detector in One Minute using Python | #python #code #programming #softwareengineering,2023-04-10T14:24:15Z,688,4,0,2,1.08,https://www.youtube.com/watch?v=77EG2oxTig8
I CREATE SPAM EMAIL DETECTOR MACHINE LEARNING MODEL USING PYTHON | Machine learning projects,2023-10-13T16:00:55Z,2792,42,0,5,4.1,https://www.youtube.com/watch?v=u6eFNqXuA4w
I CREATE CRM DASHBOARD USING PYTHON &  PYTHON DASHBOARD,2024-02-17T16:00:37Z,637,12,0,2,7.62,https://www.youtube.com/watch?v=ug3phGVl8qY
I CREATE FAST FOOD ORDERING WEBSITE USING PYTHON && PYTHON PROGRAMMING && PYTHON PROJECTS,2024-02-11T16:00:35Z,722,24,0,4,4.75,https://www.youtube.com/watch?v=o7H7TyJh_b8
I CREATE WEATHER PREDICTION MACHINE LEARNING MODEL USING PYTHON,2023-10-07T16:00:19Z,2375,62,0,8,6.15,https://www.youtube.com/watch?v=WvdOyWH0s_0
I Create Fashion Recommendation Machine Learning Model With Python,2023-12-18T16:00:00Z,1850,38,0,7,8.45,https://www.youtube.com/watch?v=-mgy9vfDLbw
I CREATE FOOD RECIPES GENERATOR MACHINE LEARNING MODEL USING PYTHON | Machine learning projects,2023-10-03T16:00:20Z,2206,16,0,1,3.07,https://www.youtube.com/watch?v=J44RWOLzAzI
I CREATE ZOMBIE SHOOTER GAME USING PYTHON,2023-09-04T15:00:35Z,1031,21,0,4,5.47,https://www.youtube.com/watch?v=eYo26i5uJf8
I CREATE HEALTH & FITNESS APP USING PYTHON || PYTHON PROJECTS FOR BEGINNERS,2024-01-21T16:00:15Z,1172,23,0,0,9.3,https://www.youtube.com/watch?v=Sx3Kw0RtmAE
I CREATE CODE SNIPPET MANAGER APP USING PYTHON,2024-03-10T16:00:38Z,138,4,0,0,6.4,https://www.youtube.com/watch?v=ub-gDl8ooy8
Text Generative AI in 15sec using Python #python,2024-03-09T13:00:47Z,126,6,0,2,0.58,https://www.youtube.com/watch?v=vtDwGj9cCdQ
I CREATE TIKTOK APP USING PYTHON &&  PYTHON PROJECTS FOR BEGINNERS,2024-01-15T16:00:30Z,373,15,0,4,8.82,https://www.youtube.com/watch?v=W45XN93H18A
I Create Pubg Game Using Python | python projects | python for beginners | pygame tutorial,2023-11-15T16:00:31Z,668,17,0,1,5.43,https://www.youtube.com/watch?v=YEhGmGJtz78
I Create Match Score Predictor Machine Learning Model Using Python | Machine learning projects,2023-10-12T16:00:40Z,306,3,0,1,4.6,https://www.youtube.com/watch?v=pytWp7YU0ns
I CREATE HOME AUTOMATION APP USING PYTHON && PYTHON PROJECTS && PYTHON PROGRAMMING,2024-02-23T16:00:00Z,362,16,0,4,7.67,https://www.youtube.com/watch?v=-5raSKaukpU
I CREATE VOICE CONTROL SYSTEM USING PYTHON | Machine learning projects,2023-10-06T17:00:39Z,354,16,0,2,4.52,https://www.youtube.com/watch?v=szKfHnKBUM8
I CREATE TENNIS GAME USING PYTHON,2023-08-24T17:28:32Z,1368,32,0,2,4.13,https://www.youtube.com/watch?v=Nrah_P2Slaw
I Create Iris flower classifier machine learning model using python,2023-10-18T13:01:00Z,163,3,0,1,3.52,https://www.youtube.com/watch?v=SC5BIMj47xc
I CREATE RECIPE MANAGER APP USING PYTHON && PYTHON PROJECTS FOR BEGINNERS && PYTHON PROGRAMMING,2024-03-02T16:00:29Z,773,28,0,0,8.8,https://www.youtube.com/watch?v=wpqN3iQ3Q5k
I CREATE DIGITAL LIBRARY APP USING PYTHON && PYTHON PROJECTS FOR BEGINNERS && PYTHON PROGRAMMING,2024-03-04T16:00:12Z,157,10,0,0,8.87,https://www.youtube.com/watch?v=ND4V-Or24G8
I CREATE BUDGET PLANNER APP USING PYTHON && PYTHON PROJECTS FOR BEGINNERS & PYTHON PROGRAMMING,2024-03-09T16:00:25Z,519,15,0,1,5.63,https://www.youtube.com/watch?v=kUjxNKne5kk
I Create Social media sentiment analysis machine learning model using Python,2023-10-27T08:00:27Z,221,5,0,0,4.13,https://www.youtube.com/watch?v=zgzwBOZqS7g
I Create Subway Surfer Game using Python || python pygame ||  Learn Pygame python #python #pygame,2023-09-30T13:00:13Z,3061,72,0,7,5.13,https://www.youtube.com/watch?v=JZJt7t3OFto
I CREATE FOOD PANDA APP USING PYTHON && PYTHON PROJECTS FOR BEGINNERS,2023-12-25T16:00:34Z,1158,35,0,8,10.4,https://www.youtube.com/watch?v=hyxNJ9CsdgQ
I CREATE SPACE DODGE GAME USING PYTHON,2023-08-31T16:00:16Z,554,16,0,0,4.12,https://www.youtube.com/watch?v=Q7SbAcZkHcE
CREATE YOUR OWN SCREEN RECORDER USING PYTHON,2023-09-18T14:00:38Z,326,13,0,6,4.58,https://www.youtube.com/watch?v=sdy9sbXitrQ
I CREATE FILE ORGANIZER APP USING PYTHON && PYTHON PROJECTS && PYTHON PROGRAMMING,2024-03-07T16:00:06Z,87,5,0,0,3.87,https://www.youtube.com/watch?v=A3I2WxqMgfg
Look how Quickly I Create GTA Game using Python | #python #code #programming,2023-04-09T15:44:01Z,1625,24,0,1,1.37,https://www.youtube.com/watch?v=ffx3RuZFr2Q
I CREATE MUSIC PLAYER APP USING PYTHON && PYTHON PROJECTS && PYTHON PROGRAMMING,2024-02-29T16:00:29Z,120,7,0,2,6.4,https://www.youtube.com/watch?v=n_9B10NwnOo
I CREATE DARK MODE CRYPTO DASHBOARD USING PYTHON,2024-02-20T13:00:25Z,254,9,0,0,5.53,https://www.youtube.com/watch?v=XSNkRWEtzxA
I Create Uber Eats App in 3min using Python && Python projects for beginners,2024-03-28T16:00:27Z,105,6,0,1,5.9,https://www.youtube.com/watch?v=Lht6gpAKZgA
EMPLOYES MANAGMENT APP USING PYTHON && PYTHON PROJECTS FOR BEGINNERS && PYTHON PROGRAMMING & #python,2024-03-22T16:00:11Z,125,10,0,0,5.68,https://www.youtube.com/watch?v=GinQ2S-2wtw
I CREATE SPOTIFY APP USING PYTHON && PYTHON PROJECTS FOR BEGINNERS,2024-01-07T16:00:02Z,1754,38,0,6,7.2,https://www.youtube.com/watch?v=1C0poNtxRTA
I CREATE GOOGLE MAP APP USING PYTHON && PYTHON PROJECTS FOR BEGINNERS,2023-12-29T16:00:29Z,420,20,0,4,8.6,https://www.youtube.com/watch?v=Qz08IG_zd5w
I CREATE NETFLIX APP USING PYTHON && PYTHON PROJECTS FOR BEGINNERS,2024-01-12T12:30:08Z,479,13,0,3,6.68,https://www.youtube.com/watch?v=5R7VYwkcVAE
I CREATE SNAPCHART APP USING PYTHON,2024-01-28T16:00:13Z,337,18,0,0,10.27,https://www.youtube.com/watch?v=La1Ct5D_cV4
